date	time	username	to	replies	retweets	favorites	text	mentions	hashtags	id	permalink	processed_text	sentences_tone	document_tones	sadness	confident	joy	analytical	anger	tentative	fear
2020-04-05	04:23:33	theCanonFanboy		1	0	5	True story! #coronavirus #AirPollution #covid19 #lockdowninindia		#coronavirus #AirPollution #covid19 #lockdowninindia	1246654687153016833	https://twitter.com/theCanonFanboy/status/1246654687153016833	true story coronavirus airpollution covid19 lockdowninindia		[{'score': 0.650397, 'tone_id': 'joy', 'tone_name': 'Joy'}, {'score': 0.80026, 'tone_id': 'confident', 'tone_name': 'Confident'}]		1.0	1.0				
2020-04-05	04:25:52	shakti_113		1	0	1	1/9 Request you to take immediate action and bestow faith in the people so that we can fight the war against #Corona Together. At this time it seems far from site by visiting the above facility. Regards, A Responsible Citizen		#Corona	1246655268282195973	https://twitter.com/shakti_113/status/1246655268282195973	request take immediate action bestow faith people fight war corona together time seems far site visiting facility regard responsible citizen		[]							
2020-04-05	04:48:27	jainendra_karn		0	0	0	corruption by our fellow unscrupulous citizens; and when back would help India fight COVID 19.			1246660952319123457	https://twitter.com/jainendra_karn/status/1246660952319123457	corruption fellow unscrupulous citizen back would help india fight covid		[]							
2020-04-05	04:59:11	RameshC1956	sardesairajdeep	0	0	0	India cannt be ruled from media houses, amr chair of Journalists, google, WA of pseudo intellectuals And SM. It has to be from Delhi till #covid. So chill. 		#covid	1246663654906290177	https://twitter.com/RameshC1956/status/1246663654906290177	india cannt ruled medium house amr chair journalist google wa pseudo intellectual sm delhi till covid chill		[]							
2020-04-05	05:24:01	warileebi_		0	0	0	I am under compete lockdown today. Hands cuffed. #dogsofinstagram #family #huntertales #instagram @Imphal https://www.instagram.com/p/B-llsdaHXje/?igshid=11ee5ho95bhbm		#dogsofinstagram #family #huntertales #instagram	1246669901625987072	https://twitter.com/warileebi_/status/1246669901625987072	compete lockdown today hand cuffed dogsofinstagram family huntertales instagram USER_MENTION URL		[{'score': 0.741973, 'tone_id': 'joy', 'tone_name': 'Joy'}]			1.0				
2020-04-05	06:26:55	Amrender_	gssjodhpur	0	0	0	I kwn very well about today nation conditionnd i aslo with u !!!!!But Now tell me !!!what is the treatment of the #corona nd don't need to foolish the public @PMOIndia @narendramodi @ashokgehlot51	@PMOIndia @narendramodi @ashokgehlot51	#corona	1246685730048479233	https://twitter.com/Amrender_/status/1246685730048479233	kwn well today nation conditionnd aslo u tell treatment corona nd dont need foolish public USER_MENTION USER_MENTION USER_MENTION		[]							
2020-04-05	06:37:33	_anilbahl		0	0	0	#TheplaJeera #PooriMasala #AluCurry #MoongDālHalvā made awesome breakfast. #Creativity #CoViD19 #Vegetarian #Food #India @Eklavya Model Residential School Lumla, Tawang https://www.instagram.com/p/B-luHEajrad/?igshid=r6pd4yffk1r7		#TheplaJeera #PooriMasala #AluCurry #MoongD #Creativity #CoViD19 #Vegetarian #Food #India	1246688408682016768	https://twitter.com/_anilbahl/status/1246688408682016768	theplajeera poorimasala alucurry made awesome breakfast creativity covid19 vegetarian food india USER_MENTION model residential school lumla tawang URL		[{'score': 0.860394, 'tone_id': 'joy', 'tone_name': 'Joy'}]			1.0				
2020-04-05	07:08:31	Nitishah45		9	0	78	My cooking skill is getting better #lockdown #Quarantine		#lockdown #Quarantine	1246696200159391744	https://twitter.com/Nitishah45/status/1246696200159391744	cooking skill getting better lockdown quarantine		[{'score': 0.526812, 'tone_id': 'joy', 'tone_name': 'Joy'}]			1.0				
2020-04-05	08:24:07	yadav1prashant1	ZSiddiki	1	0	1	I want to know how much satisfied you are with our government the steps which are taken by them are good or need amendments for COVID.			1246715227338502150	https://twitter.com/yadav1prashant1/status/1246715227338502150	want know much satisfied government step taken good need amendment covid		[{'score': 0.653099, 'tone_id': 'analytical', 'tone_name': 'Analytical'}]				1.0			
2020-04-05	09:48:57	shivamgour54		0	0	2	"*Overall Protection for the country: @PMOIndia **Protection from Deadly #Covid19India :Doctor &amp; Nurses ***Protection from #covid786: Police ___________ ""Other Countries are fighting with only Covid-19 But India has to fight for both Covid-19 &amp; Covid-786."" "	@PMOIndia	#Covid19India #covid786	1246736575909654528	https://twitter.com/shivamgour54/status/1246736575909654528	protection country USER_MENTION deadly covid19india doctor nurse covid786 police country fighting covid19 india fight covid19 covid786		[{'score': 0.506763, 'tone_id': 'analytical', 'tone_name': 'Analytical'}]				1.0			
2020-04-05	09:52:06	MalikRamzanIsra		0	0	0	How to use touchscreens and self-checkouts safely during the coronavirus outbreak @SCFGallagher	@SCFGallagher		1246737367588909057	https://twitter.com/MalikRamzanIsra/status/1246737367588909057	use touchscreen selfcheckouts safely coronavirus outbreak USER_MENTION		[{'score': 0.801827, 'tone_id': 'analytical', 'tone_name': 'Analytical'}]				1.0			
2020-04-05	09:53:20	nalwa_raj		0	0	1	In this fight with covid 19 wish we all Indians in the place of 5 minutes tali pooja at 5pm or now 9pm diya, candle, cellphone torch pooja we might prayed to God seriously,saved food, clothes, medicines , some money and given to needy ones. Where is this nation moving ?			1246737677241569282	https://twitter.com/nalwa_raj/status/1246737677241569282	fight covid wish indian place minute talus pooja diya candle cellphone torch pooja might prayed god food clothes medicine money given needy one nation moving		[]							
2020-04-05	10:28:24	IRSHADC21		1	0	1	While lockdown in process Kmc n local authorities JB opportunity to clean the entire city from filth n litter once &amp; fr all. Cleanup all mega trash trolleys and then run a campaign fr citizens to keep it that way fr future too to have better hygiene and clean atmosphere for ever			1246746501885411328	https://twitter.com/IRSHADC21/status/1246746501885411328	lockdown process kmc n local authority jb opportunity clean entire city filth n litter fr cleanup mega trash trolley run campaign fr citizen keep way fr future better hygiene clean atmosphere ever		[]							
2020-04-05	11:00:42	SVarshiniK		0	0	0	When the world is trying to save itself from #Covid_19, #boredom and finding ways to kill #time during #lockdown! Found this beauty by @MitchAlbom to #learn how did man devised measurement of time and made himself to run! #books #2020reads #10by10	@MitchAlbom	#Covid_19 #boredom #time #lockdown #learn #books #2020reads #10by10	1246754633957031936	https://twitter.com/SVarshiniK/status/1246754633957031936	world trying save covid_19 boredom finding way kill time lockdown found beauty USER_MENTION learn man devised measurement time made run book		[{'score': 0.665353, 'tone_id': 'joy', 'tone_name': 'Joy'}, {'score': 0.941785, 'tone_id': 'analytical', 'tone_name': 'Analytical'}]			1.0	1.0			
2020-04-05	11:49:23	Subham708687688		0	0	0	We r all one not alone. Will fight together with the situation of COVID-19 @narendramodi @himantabiswa	@narendramodi @himantabiswa		1246766883832881152	https://twitter.com/Subham708687688/status/1246766883832881152	r one alone fight together situation covid19 USER_MENTION USER_MENTION		[{'score': 0.585594, 'tone_id': 'sadness', 'tone_name': 'Sadness'}]	1.0						
2020-04-05	13:11:40	DayanandJakhar	narendramodi	1	0	0	Main reason spreading Corona Virus in Armed Forces and becoming beyond control from further spreading is that whole Army lives in together in barracks and social distancing method is not possible. If Army gets infected then who will secure our country's border?			1246787590826622976	https://twitter.com/DayanandJakhar/status/1246787590826622976	main reason spreading corona virus armed force becoming beyond control spreading whole army life together barrack social distancing method possible army get infected secure country border		[{'score': 0.589295, 'tone_id': 'analytical', 'tone_name': 'Analytical'}]				1.0			
2020-04-05	15:45:05	SakibAl79912228		0	0	0	In Support with our #doctors #NursesCOVID19 and to Fight with #Covid_19 @TheQuint @ndtvindia @aajtak – at F Block, Shaheen Bagh	@TheQuint @ndtvindia @aajtak	#doctors #NursesCOVID19 #Covid_19	1246826198946041857	https://twitter.com/SakibAl79912228/status/1246826198946041857	support doctor nursescovid19 fight covid_19 USER_MENTION USER_MENTION USER_MENTION f block shaheen bagh		[{'score': 0.620279, 'tone_id': 'analytical', 'tone_name': 'Analytical'}]				1.0			
2020-04-05	16:20:22	TheArif24		0	0	0	4-We want you to announce more help package for our migrant workers across the country. #COVID2019 #corona #Sunday #task		#COVID2019 #corona #Sunday #task	1246835076970606593	https://twitter.com/TheArif24/status/1246835076970606593	want announce help package migrant worker across country covid2019 corona sunday task		[]							
2020-04-05	16:26:33	sonujournal		0	2	6	#9PM9minute @PMOIndia @narendramodi @Rahulbarnwal45 @anup_bjp @rahulias6 @HMOIndia @DrKumarVishwas @Abhishe62448630 @AbhayVarn @TajinderBagga Hope! as our country unite today, same our country fight d evil #corona 	@PMOIndia @narendramodi @Rahulbarnwal45 @anup_bjp @rahulias6 @HMOIndia @DrKumarVishwas @Abhishe62448630 @AbhayVarn @TajinderBagga	#9PM9minute #corona	1246836636773527556	https://twitter.com/sonujournal/status/1246836636773527556	USER_MENTION USER_MENTION USER_MENTION USER_MENTION USER_MENTION USER_MENTION USER_MENTION USER_MENTION USER_MENTION USER_MENTION hope country unite today country fight evil corona		[{'score': 0.607008, 'tone_id': 'joy', 'tone_name': 'Joy'}, {'score': 0.5538, 'tone_id': 'tentative', 'tone_name': 'Tentative'}]			1.0			1.0	
2020-04-05	16:33:42	Aiyan_AR10		0	0	6	Finally corona got married to #india. Anpad nesel – at Kashmir		#india	1246838432212672512	https://twitter.com/Aiyan_AR10/status/1246838432212672512	finally corona got married india anpad nesel kashmir		[{'score': 0.652689, 'tone_id': 'joy', 'tone_name': 'Joy'}, {'score': 0.506763, 'tone_id': 'analytical', 'tone_name': 'Analytical'}]			1.0	1.0			
2020-04-05	16:38:49	BeingParag		0	0	0	On a simple note of faith & believe. #9pm9minutes #Covid19 #lockdown @Ahmedabad, India https://www.instagram.com/p/B-my66-Fmr64nEYgDzh4wvDUXrMO7dLjegolR80/?igshid=1fvg3kf2kag9k		#9pm9minutes #Covid19 #lockdown	1246839723789860867	https://twitter.com/BeingParag/status/1246839723789860867	simple note faith believe covid19 lockdown USER_MENTION india URL		[{'score': 0.817498, 'tone_id': 'joy', 'tone_name': 'Joy'}, {'score': 0.564476, 'tone_id': 'analytical', 'tone_name': 'Analytical'}]			1.0	1.0			
2020-04-05	16:40:27	ravibrothers8		0	0	0	We are One We will be One We Together Fight against Corona Thank you Frontline departments #APFightsCorona #9baje9minutes – at Kalyan East		#APFightsCorona #9baje9minutes	1246840133036281856	https://twitter.com/ravibrothers8/status/1246840133036281856	one one together fight corona thank frontline department apfightscorona kalyan east		[{'score': 0.601045, 'tone_id': 'joy', 'tone_name': 'Joy'}]			1.0				
2020-04-05	16:43:56	imrantakkar		0	0	0	Covid-19 &amp; other fears @AmirRana	@AmirRana		1246841010203824130	https://twitter.com/imrantakkar/status/1246841010203824130	covid19 fear USER_MENTION		[{'score': 0.956511, 'tone_id': 'fear', 'tone_name': 'Fear'}]							1.0
2020-04-05	16:48:05	Mujahids1	TeamTrump	0	0	0	Trump ji I have one idea to get back CORONA, Drink 3 times hot water 30 min before Eating, And do wazu(wash mouth,nose,face,hands,masah on hair with washed hands and legs) 10 times per day And eat hot meal veg and mutton only no chicken Drink only water not drink for some days			1246842053025124353	https://twitter.com/Mujahids1/status/1246842053025124353	trump ji one idea get back corona drink time hot water min eating hair washed hand leg time per day eat hot meal veg mutton chicken drink water drink day		[]							
2020-04-05	17:06:32	Theabhisheknema		0	0	0	With these lamps, we also pray to God to get rid of this life-threatening pandemic as soon as possible. #stayhome #9mintuesat9pm #9minutesforindia #corona #5april9pm9minute #9pm9minutes #aprildiwali #lightsoff… https://www.instagram.com/p/B-m2F5Dl5lB/?igshid=18ghpq346clwc		#stayhome #stayhome #9mintuesat9pm #9minutesforindia #corona #5april9pm9minute #9pm9minutes #aprildiwali #lightsoff	1246846698930032641	https://twitter.com/Theabhisheknema/status/1246846698930032641	lamp also pray god get rid lifethreatening pandemic soon possible stayhome corona aprildiwali URL		[{'score': 0.681699, 'tone_id': 'tentative', 'tone_name': 'Tentative'}]						1.0	
2020-04-05	17:39:27	shriramyoga		0	0	0	"A man is free to do anything; but there is no choice regarding the selection of its consequences. ""Pt. Shriram Sharma Acharya"" Journey towards innerself. #meditation #antah #urja #sadhna #COVID19 #drnaveen… https://www.instagram.com/p/B-m53HVFi0b/?igshid=wcfcqz3u93tq"		#meditation #antah #urja #sadhna #drnaveen	1246854981958811648	https://twitter.com/shriramyoga/status/1246854981958811648	man free anything choice regarding selection consequence pt shriram sharma acharya journey towards innerself meditation antah urja sadhna covid19 URL		[{'score': 0.904038, 'tone_id': 'analytical', 'tone_name': 'Analytical'}]				1.0			
2020-04-05	18:18:54	VerchaswaGupta		0	0	3	#9PM9minute #IndiaFightsCorona United we stand against Corona.. Jai Hind Jai Bharat 		#9PM9minute #IndiaFightsCorona	1246864909100449792	https://twitter.com/VerchaswaGupta/status/1246864909100449792	indiafightscorona united stand corona jai hind jai bharat		[]							
2020-04-05	18:33:18	Ratnesh11792702		0	0	0	#Celebration of the day with all Indians fight against corona. At 9 PM on 5-04-2020 			1246868534560354304	https://twitter.com/Ratnesh11792702/status/1246868534560354304	celebration day indian fight corona pm		[]							
2020-04-05	18:44:20	gouravyadav2350		0	0	0	Hope for better future.solidarity for covid warriors 			1246871309260173312	https://twitter.com/gouravyadav2350/status/1246871309260173312	hope better future.solidarity covid warrior	[{'sentence_id': 0, 'text': 'hope better future.solidarity', 'tones': [{'score': 0.984352, 'tone_id': 'tentative', 'tone_name': 'Tentative'}]}, {'sentence_id': 1, 'text': 'covid warrior', 'tones': []}]	[{'score': 0.994704, 'tone_id': 'tentative', 'tone_name': 'Tentative'}]						1.0	
2020-04-05	19:01:24	khushbookapoor		0	0	1	ये एक चिराग कई आँधियों पे भारी है ! Jai Hind ! : : : : : : : #Narendra #Modi #narendramodi #narendra_modi #namo #bjp #covid #covid19 #covıd19 @narendramodi bjp4india bjp4delhi bjp4rajasthan bjp4gujarat… https://www.instagram.com/p/B-nC3j1B6cI/?igshid=14otcjv4cvztl	@narendramodi	#Narendra #Modi #narendramodi #narendra_modi #namo #bjp #covid #covid19 #cov	1246875604298772480	https://twitter.com/khushbookapoor/status/1246875604298772480	jai hind narendra modi narendramodi narendra_modi namo bjp covid covid19 USER_MENTION bjp4india bjp4delhi bjp4rajasthan URL		[]							
2020-04-05	21:26:16	maheshbhoj	SetuAarogya	0	0	0	@republic Excellent initiative with this App. Thank you for getting this to combat Covid-19 probable cases. Hope this virus is eradicated soon. You have our full cooperation. All the best for #GoCoronaGo	@republic	#GoCoronaGo	1246912059628904449	https://twitter.com/maheshbhoj/status/1246912059628904449	USER_MENTION excellent initiative app thank getting combat covid19 probable case hope virus eradicated soon full cooperation best gocoronago		[{'score': 0.760184, 'tone_id': 'joy', 'tone_name': 'Joy'}, {'score': 0.836129, 'tone_id': 'tentative', 'tone_name': 'Tentative'}]			1.0			1.0	
2020-04-06	01:35:59	PrabhuNs_		20	37	203	#Agra #IndiaFightsCorona #CoronaWarriors leading from the front ;Thankful to Dr Anshul and his #teamRRT helping all bulk samples and transferring #Covid19 patients to Isolation Beds ; attending to all call related to #Covid19 related symptoms in field 24*7 @UPGovt	@UPGovt	#Agra #IndiaFightsCorona #CoronaWarriors #teamRRT #Covid19 #Covid19	1246974902583713792	https://twitter.com/PrabhuNs_/status/1246974902583713792	agra indiafightscorona coronawarriors leading front thankful dr anshul teamrrt helping bulk sample transferring covid19 patient isolation bed attending call related covid19 related symptom field USER_MENTION		[{'score': 0.774376, 'tone_id': 'analytical', 'tone_name': 'Analytical'}]				1.0			
2020-04-06	02:32:03	sugandha_sp		0	0	1	Sex Work in the Times of COVID-19: How Delhi’s GB Road is Coping 			1246989013472260097	https://twitter.com/sugandha_sp/status/1246989013472260097	sex work time covid19 gb road coping		[]							
2020-04-06	05:22:13	PramodChturvedi		1	0	1	Very informative Interview Doctor @dheerajkaul4 on @ABPNews, respect your contribution for country and humanity. Really you #CoronaWarriors are Real Hero. Salute all of you. #Covid_19 #COVID2019 #Covid19India #coronavirusindia	@dheerajkaul4 @ABPNews	#CoronaWarriors #Covid_19 #COVID2019 #Covid19India #coronavirusindia	1247031836477280262	https://twitter.com/PramodChturvedi/status/1247031836477280262	informative interview doctor USER_MENTION USER_MENTION respect contribution country humanity really coronawarriors real hero salute covid_19 covid2019 covid19india coronavirusindia		[{'score': 0.684364, 'tone_id': 'joy', 'tone_name': 'Joy'}, {'score': 0.724236, 'tone_id': 'analytical', 'tone_name': 'Analytical'}]			1.0	1.0			
2020-04-06	05:48:18	SakalMediaNews		0	0	2	33 more #COVID19 cases in #Maharashtra; state tally jumps to 781: Health Official http://www.esakal.com #Sakal #SakalNews #viral #ViralNews #SakalMedia #news #Corona #COVID2019 #Covid19Out #coronavirus #Covid_19 #COVID		#COVID19 #Maharashtra #Sakal #SakalNews #viral #ViralNews #SakalMedia #news #Corona #COVID2019 #Covid19Out #coronavirus #Covid_19 #COVID	1247038403670986752	https://twitter.com/SakalMediaNews/status/1247038403670986752	covid19 case maharashtra state tally jump health official URL sakal sakalnews viral viralnews sakalmedia news corona covid2019 covid19out coronavirus covid_19 covid		[]							
2020-04-06	06:07:55	Munishwar17		0	0	0	#9pm9minute India is ready for one of a kind experience by lighting diyas, candles, or waving torch or mobile flashlight to shun the darkness of COVID-19. via NaMo App		#9pm9minute	1247043337590149121	https://twitter.com/Munishwar17/status/1247043337590149121	india ready one kind experience lighting diyas candle waving torch mobile flashlight shun darkness covid19 via namo app		[{'score': 0.5538, 'tone_id': 'tentative', 'tone_name': 'Tentative'}]						1.0	
2020-04-06	06:43:46	PramodP01814627	the_hindu	0	0	1	How many have lost lives due to #lockdown. Any figures?		#lockdown	1247052359911370753	https://twitter.com/PramodP01814627/status/1247052359911370753	many lost life due lockdown figure		[{'score': 0.830945, 'tone_id': 'sadness', 'tone_name': 'Sadness'}, {'score': 0.842108, 'tone_id': 'analytical', 'tone_name': 'Analytical'}]	1.0			1.0			
2020-04-06	06:57:45	Handle_Rahul	TigerRajaSingh	0	0	0	Will there be any action taken against this BJP MLA for breaking the lockdown rules and also social distancing protocol? @hydcitypolice @narendramodi @PMOIndia @TOIHyderabad @BJP4Telangana	@hydcitypolice @narendramodi @PMOIndia @TOIHyderabad @BJP4Telangana		1247055879242825729	https://twitter.com/Handle_Rahul/status/1247055879242825729	action taken bjp mla breaking lockdown rule also social distancing protocol USER_MENTION USER_MENTION USER_MENTION USER_MENTION USER_MENTION		[]							
2020-04-06	08:21:59	theartofmezame		0	0	1	Thank goodness for a good government. As much as we can be critical usually of what the government does, I have to say they’re doing a fine job ensuring NO Singaporeans fall through the cracks with stimulus packages aimed to help ride through this COVID-19 storm. 			1247077078576427008	https://twitter.com/theartofmezame/status/1247077078576427008	thank goodness good government much critical usually government say fine job ensuring singaporean fall crack stimulus package aimed help ride covid19 storm		[{'score': 0.545034, 'tone_id': 'joy', 'tone_name': 'Joy'}]			1.0				
2020-04-06	08:47:04	vijaythakkar_	ikamalhaasan	2	2	34	Think positive way Mr @ikamalhaasan every people of our country see entire world situation we are 130 crore people only 3 or 4 thousand corona patients we have to proud with our PM who cares of every indian and take early precautions	@ikamalhaasan		1247083391582900226	https://twitter.com/vijaythakkar_/status/1247083391582900226	think positive way mr USER_MENTION every people country see entire world situation crore people thousand corona patient proud pm care every indian take early precaution		[{'score': 0.617835, 'tone_id': 'joy', 'tone_name': 'Joy'}, {'score': 0.918058, 'tone_id': 'confident', 'tone_name': 'Confident'}]		1.0	1.0				
2020-04-06	09:33:35	abhijitmahanta_	itz_me33	0	0	0	Corona be like - am I a joke ? 			1247095096358531080	https://twitter.com/abhijitmahanta_/status/1247095096358531080	corona like joke		[{'score': 0.946222, 'tone_id': 'tentative', 'tone_name': 'Tentative'}]						1.0	
2020-04-06	11:14:35	Anees9540655407	sonamakapoor	0	0	0	Help the poors who are hungry in the lockdown - Mohd Anees Ahmad Khan visit http://impactgu.ru/oM6fqR to contribute and share the story.			1247120512305606656	https://twitter.com/Anees9540655407/status/1247120512305606656	help poor hungry lockdown mohd anees ahmad khan visit URL contribute share story		[{'score': 0.57244, 'tone_id': 'sadness', 'tone_name': 'Sadness'}]	1.0						
2020-04-06	11:23:52	KapoorSudhanshu	narendramodi	2	1	1	Dear PM sir, u r aware that Mumbai is d new corona hotspot with 30% deaths of entire country here. The state does not have BJP govt but i request u to personally look into d situation here. The lockdown here in not being implemented properly with people roaming on streets at will			1247122851209064449	https://twitter.com/KapoorSudhanshu/status/1247122851209064449	dear pm sir u r aware mumbai new corona hotspot death entire country state bjp govt request u personally look situation lockdown implemented properly people roaming street		[{'score': 0.75414, 'tone_id': 'sadness', 'tone_name': 'Sadness'}]	1.0						
2020-04-06	11:58:36	mksw85official		0	0	2	Well done #PPP &amp; #SindhGov. We need this in as many places as possible #mksw85official #iNNA #lockdown #COVID19 #COVIDIDIOTS #StayHomeSaveLives @MuradAliShahPPP @BakhtawarBZ @BBhuttoZardari @AseefaBZ @SaeedGhani1 @murtazawahab1 @SindhCMHouse @SindhGovt_	@MuradAliShahPPP @BakhtawarBZ @BBhuttoZardari @AseefaBZ @SaeedGhani1 @murtazawahab1 @SindhCMHouse @SindhGovt_	#PPP #SindhGov #mksw85official #iNNA #lockdown #COVID19 #COVIDIDIOTS #StayHomeSaveLives	1247131590695796737	https://twitter.com/mksw85official/status/1247131590695796737	well done pp sindhgov need many place possible mksw85official inna lockdown covid19 covididiots stayhomesavelives USER_MENTION USER_MENTION USER_MENTION USER_MENTION USER_MENTION USER_MENTION USER_MENTION USER_MENTION		[{'score': 0.706617, 'tone_id': 'joy', 'tone_name': 'Joy'}]			1.0				
2020-04-06	12:25:17	Smarsh_shah	cinemapudhar	1	0	4	Ofcourse it's unplanned like Coronavirus. If he didn't imposed it on as emergency, today nos. wud be 30k not 3k considering d idiots &amp; amt of psychi Pseudos we have.			1247138305835032577	https://twitter.com/Smarsh_shah/status/1247138305835032577	ofcourse unplanned like coronavirus didnt imposed emergency today no wud considering idiot amt psychi pseudo		[{'score': 0.679015, 'tone_id': 'anger', 'tone_name': 'Anger'}]					1.0		
2020-04-06	12:27:25	tauseefjourno		0	0	1	When we open the lockdown it will be after we have ensured that the state is corona free. Even if 1 corona +ve person is left, it will be very difficult to open the lockdown &amp; that is why it may take time @AwasthiAwanishK, Additional Chief Secretary, Uttar Pradesh. #CoronaUpdates	@AwasthiAwanishK	#CoronaUpdates	1247138842236223493	https://twitter.com/tauseefjourno/status/1247138842236223493	open lockdown ensured state corona free even corona person left difficult open lockdown may take time USER_MENTION additional chief secretary uttar pradesh coronaupdates		[{'score': 0.627109, 'tone_id': 'sadness', 'tone_name': 'Sadness'}, {'score': 0.523822, 'tone_id': 'analytical', 'tone_name': 'Analytical'}, {'score': 0.769251, 'tone_id': 'tentative', 'tone_name': 'Tentative'}]	1.0			1.0		1.0	
2020-04-06	13:47:41	GundalaRk	KChiruTweets	0	0	0	Corona cover song 			1247159043640061953	https://twitter.com/GundalaRk/status/1247159043640061953	corona cover song		[{'score': 0.717929, 'tone_id': 'joy', 'tone_name': 'Joy'}]			1.0				
2020-04-06	14:09:09	sridharfca	ikamalhaasan	0	0	0	Kamalji.your lr to PM is akin to a fox presiding over a vegetarian congress and trying to catch eyeballs. It's true that this lockdown could have turned people a bit of a psychic but it appears that you have had a overload. While you had the audacity to depict Lord Shiva (1/2)			1247164445429661697	https://twitter.com/sridharfca/status/1247164445429661697	kamalji.your lr pm akin fox presiding vegetarian congress trying catch eyeball true lockdown could turned people bit psychic appears overload audacity depict lord shiva		[{'score': 0.514939, 'tone_id': 'sadness', 'tone_name': 'Sadness'}, {'score': 0.594263, 'tone_id': 'tentative', 'tone_name': 'Tentative'}]	1.0					1.0	
