date	time	username	to	replies	retweets	favorites	text	mentions	hashtags	id	permalink	processed_text	sentences_tone	document_tones	sadness	confident	joy	analytical	anger	tentative	fear
2020-03-30	08:05:28	Real_Younuszubi		0	0	1	In this time of the COVID-19 pandemic, be peaceful knowing that: •Being quarantined does not necessarily mean you are COVID-19 +ve •Being COVID-19 +ve does not necessarily mean you will immediately die •And clearly, in the overall process of Life, death is unavoidable. – at Magam			1244536205942771712	https://twitter.com/Real_Younuszubi/status/1244536205942771712	time covid19 pandemic peaceful knowing quarantined necessarily mean covid19 covid19 necessarily mean immediately die clearly overall process life death unavoidable magam		[{'score': 0.582791, 'tone_id': 'sadness', 'tone_name': 'Sadness'}, {'score': 0.751512, 'tone_id': 'confident', 'tone_name': 'Confident'}, {'score': 0.852071, 'tone_id': 'analytical', 'tone_name': 'Analytical'}]	1.0	1.0		1.0			
2020-03-30	09:04:09	chawlashravan	achu21in	1	0	1	Also valuable time since January was lost building the massive PR campaign around the trump visit and the MP coup. All this while the corona situation was unfolding globally. Come on. Wake up !			1244550973084684290	https://twitter.com/chawlashravan/status/1244550973084684290	also valuable time since january lost building massive pr campaign around trump visit mp coup corona situation unfolding globally come wake		[]							
2020-03-30	09:08:33	AkshatBasoya		0	0	0	#PMCaresFunds our small contribution towards the nation... Let’s win against Corona together. @narendramodi #PMCARES #IndiaFightsCorona #IndiaVsCorona #21daysLockdownIndia #100CrorePledge #2019nCoV #21DaysChallenge	@narendramodi	#PMCaresFunds #PMCARES #IndiaFightsCorona #IndiaVsCorona #21daysLockdownIndia #100CrorePledge #2019nCoV #21DaysChallenge	1244552080305446914	https://twitter.com/AkshatBasoya/status/1244552080305446914	pmcaresfunds small contribution towards nation win corona together USER_MENTION pmcares indiafightscorona indiavscorona		[{'score': 0.647318, 'tone_id': 'joy', 'tone_name': 'Joy'}]			1.0				
2020-03-30	09:58:49	vineet_183	vineet_183	0	0	0	@PMOIndia @ChiefSecyUP @CMOfficeUP @LabourMinistry @ficci_india Pls think on submission of @socialepfo @esichq to avoid making corporates non compliant in #lockdown #Lockdown21 #AskZee	@PMOIndia @ChiefSecyUP @CMOfficeUP @LabourMinistry @ficci_india @socialepfo @esichq	#lockdown #Lockdown21 #AskZee	1244564729579728897	https://twitter.com/vineet_183/status/1244564729579728897	USER_MENTION USER_MENTION USER_MENTION USER_MENTION USER_MENTION pls think submission USER_MENTION USER_MENTION avoid making corporates non compliant lockdown lockdown21 askzee		[]							
2020-03-30	12:45:17	thatslilysam		0	0	0	I just realise besides the cases of domestic violence on the rise in china, think about the child abuse some children have to face during a lockdown. School is a place to be free from it awhile, an escape			1244606624469114886	https://twitter.com/thatslilysam/status/1244606624469114886	realise besides case domestic violence rise china think child abuse child face lockdown school place free awhile escape		[{'score': 0.820081, 'tone_id': 'analytical', 'tone_name': 'Analytical'}]				1.0			
2020-03-30	13:08:24	dillipk79824811		0	0	0	A religious programme was organised at the ‘markaz’ (the mosque) around March 18 and more than 500 people from various States,countries had attended the programme; many of them had returned. Violation of lockdown orders which has potential to threaten fight against Corona.			1244612439481520130	https://twitter.com/dillipk79824811/status/1244612439481520130	religious programme organised mosque around march people various attended programme many returned violation lockdown order potential threaten fight corona		[{'score': 0.525007, 'tone_id': 'tentative', 'tone_name': 'Tentative'}]						1.0	
2020-03-30	15:00:34	vijayrpandey		5	36	45	In a bid to control #coronavirus outbreak in the state, Mumbai's bMC @mybmc issued an order saying all bodies of coronavirus patients should be cremated irrespective of religion and burial will not be allowed.The funeral should not involve more than five people. #Covid19India	@mybmc	#coronavirus #Covid19India	1244640668112138243	https://twitter.com/vijayrpandey/status/1244640668112138243	bid control coronavirus outbreak state mumbai bmc USER_MENTION issued order saying body coronavirus patient cremated irrespective religion burial allowed.the funeral involve five people covid19india	[{'sentence_id': 0, 'text': 'bid control coronavirus outbreak state mumbai bmc USER_MENTION issued order saying body coronavirus patient cremated irrespective religion burial allowed.the', 'tones': [{'score': 0.713028, 'tone_id': 'analytical', 'tone_name': 'Analytical'}]}, {'sentence_id': 1, 'text': 'funeral involve five people covid19india', 'tones': [{'score': 0.54787, 'tone_id': 'sadness', 'tone_name': 'Sadness'}]}]	[{'score': 0.540886, 'tone_id': 'sadness', 'tone_name': 'Sadness'}, {'score': 0.812664, 'tone_id': 'analytical', 'tone_name': 'Analytical'}]	1.0			1.0			
2020-03-30	15:02:16	mohitsaxena707		0	0	0	@HTNoidaGzb @dm_ghaziabad @MoHFW_INDIA @myogiadityanath Tired complaining abt my neighbor, CORONA suspect in home quarantine by DM GZB, he is now buying steamer, cough medicine. Your doc @012041864531 instead of visit, to check &amp; test says steamer kharida to kya gunah kar diya? – at Nirala Eden Park	@HTNoidaGzb @dm_ghaziabad @MoHFW_INDIA @myogiadityanath		1244641098548383744	https://twitter.com/mohitsaxena707/status/1244641098548383744	USER_MENTION USER_MENTION USER_MENTION USER_MENTION tired complaining abt neighbor corona suspect home quarantine dm gzb buying steamer cough medicine doc USER_MENTION instead visit check test say steamer kharida kya gunah kar diya nirala eden park		[]							
2020-03-30	15:12:04	Real_Rohit98		0	1	1	At present, Saint Rampal Ji Maharaj has come as an incarnation of God Kabir, we are getting relief from terrible disease like corona by taking refuge of Saint Rampal Ji. Get free Nam Diksha http://bit.ly/NamDiksha @France24_en #NoMoreDreamIsComing	@France24_en	#NoMoreDreamIsComing	1244643562903371776	https://twitter.com/Real_Rohit98/status/1244643562903371776	present saint rampal ji maharaj come incarnation god kabir getting relief terrible disease like corona taking refuge saint rampal ji get free nam diksha URL USER_MENTION nomoredreamiscoming		[]							
2020-03-30	15:45:55	bhonslesiddhu		0	0	0	As a common man, I have donated my small part in #PMCaresFunds. Let us donate a small part of us to the PM Care Fund and contribute towards the country and killed viruses like Corona. – at Chandlodia		#PMCaresFunds	1244652083464130562	https://twitter.com/bhonslesiddhu/status/1244652083464130562	common man donated small part pmcaresfunds let u donate small part u pm care fund contribute towards country killed virus like corona chandlodia		[]							
2020-03-30	16:15:23	ManishKondke	republic	0	0	0	Bring Democracy to Dictatorship to control the spread of COVID 19. We Indians will always support you @PMOIndia @narendramodi @AmitShah	@PMOIndia @narendramodi @AmitShah		1244659497727078402	https://twitter.com/ManishKondke/status/1244659497727078402	bring democracy dictatorship control spread covid indian always support USER_MENTION USER_MENTION USER_MENTION		[{'score': 0.80026, 'tone_id': 'confident', 'tone_name': 'Confident'}]		1.0					
2020-03-30	16:48:08	ajayrotti	arungiri	0	0	0	No Covid. No Trump. No Modi. No Rahul Gandhi. Let's talk about MLI, Digital economy, your views on whether ALP is dying, etc 			1244667737441353729	https://twitter.com/ajayrotti/status/1244667737441353729	covid trump modi rahul gandhi let talk mli digital economy view whether alp dying etc		[]							
2020-03-30	17:09:38	Sandeepjaspal1		0	0	1	#Benefits_Of_Satsang @Sandeepjaspal1 @ANI Only true God kabir All diseases are destroyed by true devotion. Whether it is cancer or a dangerous disease like coronavirus, all diseases end. Because Supreme God kabir Saheb True worship by Saint RampalJi maharaj – at Evolve	@Sandeepjaspal1 @ANI	#Benefits_Of_Satsang	1244673151654641666	https://twitter.com/Sandeepjaspal1/status/1244673151654641666	benefits_of_satsang USER_MENTION USER_MENTION true god kabir disease destroyed true devotion whether cancer dangerous disease like coronavirus disease end supreme god kabir saheb true worship saint rampalji maharaj evolve		[]							
2020-03-30	18:01:23	bedlamfury		0	5	2	Police in India fired tear gas to disperse a stone-pelting crowd of migrant workers defying a three-week lockdown against the coronavirus that has left hundreds of thousands of poor without jobs and hungry 			1244686172040749056	https://twitter.com/bedlamfury/status/1244686172040749056	police india fired tear gas disperse stonepelting crowd migrant worker defying threeweek lockdown coronavirus left hundred thousand poor without job hungry		[{'score': 0.596888, 'tone_id': 'sadness', 'tone_name': 'Sadness'}]	1.0						
2020-03-30	18:19:35	editorrajesh		0	0	0	Now in kerala the real situation @sachin_rt and @virendersehwag Trying to do their level best for saving people from #COVID19 #COVID2019india #CoronaPandemic #coronavirusindia	@sachin_rt @virendersehwag	#COVID19 #COVID2019india #CoronaPandemic #coronavirusindia	1244690751964852224	https://twitter.com/editorrajesh/status/1244690751964852224	kerala real situation USER_MENTION USER_MENTION trying level best saving people covid19 covid2019india coronapandemic coronavirusindia		[{'score': 0.597592, 'tone_id': 'joy', 'tone_name': 'Joy'}]			1.0				
2020-03-30	19:32:21	shubhams316		0	0	0	To join the fight against Coronavirus, I have taken the Stay At Home, Save Lives Pledge and committed myself towards keeping the country safe. You can also take the pledge at https://pledge.mygov.in/stayathome/ https://pledgeapi.mygov.in/api/v2/stayathome/share/individual/5966755557 via @mygovindia @narendramodi @ChouhanShivraj	@mygovindia @narendramodi @ChouhanShivraj		1244709066892402688	https://twitter.com/shubhams316/status/1244709066892402688	join fight coronavirus taken stay home save life pledge committed towards keeping country safe also take pledge URL URL via USER_MENTION USER_MENTION USER_MENTION		[{'score': 0.775384, 'tone_id': 'analytical', 'tone_name': 'Analytical'}]				1.0			
2020-03-30	21:28:37	TheShaStories		0	0	0	@vikrantgupta73 Sir ... If people will not stop Behaving responsibly, How are we going to defeat Corona Virus ? I am feeling little depressed and Yesss I am Missing Cricket Very Muchh ...dnt knw if it's right time to miss Cricket But Cricket is something dat makes me feel alive !	@vikrantgupta73		1244738326373912576	https://twitter.com/TheShaStories/status/1244738326373912576	USER_MENTION sir people stop behaving responsibly going defeat corona virus feeling little depressed yes missing cricket muchh dnt knw right time miss cricket cricket something dat make feel alive		[{'score': 0.875996, 'tone_id': 'sadness', 'tone_name': 'Sadness'}, {'score': 0.515711, 'tone_id': 'tentative', 'tone_name': 'Tentative'}]	1.0					1.0	
2020-03-31	03:04:13	allaboutsriram	manijgd	0	1	2	#PrajnaYoga @ArtofLiving Master Jeyakirithink show his skills in solving Rubik cube blindfolded #lockdown @SriSri @AOLSwamiji	@ArtofLiving @SriSri @AOLSwamiji	#PrajnaYoga #lockdown	1244822781583187972	https://twitter.com/allaboutsriram/status/1244822781583187972	prajnayoga USER_MENTION master jeyakirithink show skill solving rubik cube blindfolded lockdown USER_MENTION USER_MENTION		[{'score': 0.589575, 'tone_id': 'joy', 'tone_name': 'Joy'}]			1.0				
2020-03-31	04:55:53	genobkk		0	0	0	127 new reported #COVID19 cases today in #Thailand bringing the total to 1,651. One more death brings the total deaths to 10. #StayHome		#COVID19 #Thailand #StayHome #StayHome	1244850884820889605	https://twitter.com/genobkk/status/1244850884820889605	new reported covid19 case today thailand bringing total one death brings total death stayhome		[{'score': 0.613344, 'tone_id': 'sadness', 'tone_name': 'Sadness'}, {'score': 0.789309, 'tone_id': 'confident', 'tone_name': 'Confident'}]	1.0	1.0					
2020-03-31	04:57:14	somyas40		0	0	0	 A lot of time to perceive environment . . . #mataktibum #leaf #nature #colour #instagram #instamood #instadaily #instapic #instatravel #instagramers #instahappy #love #blogger #explore #stayhome #corona #2020… https://www.instagram.com/p/B-Yqp7-gEXq/?igshid=fyqd21isn39a		#mataktibum #leaf #nature #colour #instagram #instamood #instadaily #instapic #instatravel #instagramers #instahappy #love #blogger #explore #stayhome #stayhome #corona	1244851222164779008	https://twitter.com/somyas40/status/1244851222164779008	lot time perceive environment mataktibum leaf nature colour instagram instamood instadaily instapic instatravel instagramers instahappy love blogger explore stayhome corona URL		[{'score': 0.907279, 'tone_id': 'joy', 'tone_name': 'Joy'}, {'score': 0.651326, 'tone_id': 'analytical', 'tone_name': 'Analytical'}]			1.0	1.0			
2020-03-31	05:08:41	akashmodak97		0	1	1	Will be launching it by today, and also will be uploading it on GitHub. #webdeveloper #javascript #API #HTML5 #css3 #bootstrap4 #Bootstrap #countUpJS #COVID19 #OpenSource		#webdeveloper #javascript #API #HTML5 #css3 #bootstrap4 #Bootstrap #countUpJS #COVID19 #OpenSource	1244854103483666432	https://twitter.com/akashmodak97/status/1244854103483666432	launching today also uploading github webdeveloper javascript api html5 css3 bootstrap4 bootstrap countupjs covid19 opensource		[{'score': 0.532616, 'tone_id': 'analytical', 'tone_name': 'Analytical'}]				1.0			
2020-03-31	05:11:16	Hardik1287	ABPNews	0	0	0	Though it was a #lockdown how such many people can gathered at a place....??		#lockdown	1244854755656183808	https://twitter.com/Hardik1287/status/1244854755656183808	though lockdown many people gathered place		[{'score': 0.842108, 'tone_id': 'analytical', 'tone_name': 'Analytical'}]				1.0			
2020-03-31	06:24:55	_arshadiqbal	suhasinih	0	0	0	On March 13, Indian government refused to consider Corona Virus a health emergency. After that day; parliament functioned, MP government toppled, utensil-clanging concerts held and Yogi defied the lockdown orders to perform religious activities. Can you hold them responsible?! 			1244873289505206273	https://twitter.com/_arshadiqbal/status/1244873289505206273	march indian government refused consider corona virus health emergency day parliament functioned mp government toppled utensilclanging concert held yogi defied lockdown order perform religious activity hold responsible		[]							
2020-03-31	07:32:50	deepakl_2000	ZEE5Premium	0	0	0	@PrimeVideoIN @hotstartweets @NetflixIndia add ; Jumanji:The next level Bhoot:Part 1 Haunted ship The Flu,Pandemic Lion King (2019) Alladin(2019) Many more thriller horror movies	@PrimeVideoIN @hotstartweets @NetflixIndia		1244890380262203395	https://twitter.com/deepakl_2000/status/1244890380262203395	USER_MENTION USER_MENTION USER_MENTION add next level haunted ship lion king many thriller horror movie		[]							
2020-03-31	08:28:48	Thejunaidhashmi		0	0	0	No one is getting out because of lockdown Except tummy			1244904467373293568	https://twitter.com/Thejunaidhashmi/status/1244904467373293568	one getting lockdown except tummy		[{'score': 0.812538, 'tone_id': 'fear', 'tone_name': 'Fear'}, {'score': 0.882284, 'tone_id': 'analytical', 'tone_name': 'Analytical'}]				1.0			1.0
2020-03-31	08:30:17	AWTEOdisha		1	1	3	We humans are not alone in our suffering in this epidemic or lockdown. There are those who suffer silently. We are going to feed as many of them as we can. Thank you @CMO_Odisha Sir for your support. #AWTEForAnimals #COVID19 @HUDDeptOdisha	@CMO_Odisha @HUDDeptOdisha	#AWTEForAnimals #COVID19	1244904840867831810	https://twitter.com/AWTEOdisha/status/1244904840867831810	human alone suffering epidemic lockdown suffer silently going feed many thank USER_MENTION sir support awteforanimals covid19 USER_MENTION		[{'score': 0.912785, 'tone_id': 'sadness', 'tone_name': 'Sadness'}]	1.0						
2020-03-31	09:23:16	harsh_chauhan_		0	0	0	To join the fight against Coronavirus, I have taken the Stay At Home, Save Lives Pledge and committed myself towards keeping the country safe. 			1244918171699568642	https://twitter.com/harsh_chauhan_/status/1244918171699568642	join fight coronavirus taken stay home save life pledge committed towards keeping country safe		[{'score': 0.895415, 'tone_id': 'analytical', 'tone_name': 'Analytical'}]				1.0			
2020-03-31	09:51:41	raashid_qazi		1	0	2	Other causes of death have gone on paid leave after covid-19 joined the fray.			1244925324644610049	https://twitter.com/raashid_qazi/status/1244925324644610049	cause death gone paid leave covid19 joined fray		[{'score': 0.655754, 'tone_id': 'sadness', 'tone_name': 'Sadness'}, {'score': 0.762356, 'tone_id': 'analytical', 'tone_name': 'Analytical'}]	1.0			1.0			
2020-03-31	10:25:25	MdSohrabinc		0	0	0	Amid Corona concern, a good news from the wildlife; tigress ST-10 has given birth to a cub at Sariska Tiger Reserve. Wish the wild life thrives in state. #Rajasthan		#Rajasthan	1244933813873954816	https://twitter.com/MdSohrabinc/status/1244933813873954816	amid corona concern good news wildlife tigress st10 given birth cub sariska tiger reserve wish wild life thrives state rajasthan		[{'score': 0.828217, 'tone_id': 'joy', 'tone_name': 'Joy'}]			1.0				
2020-03-31	11:12:03	MohdAmirkhan0		1	0	1	@pnbindia Dear Sir/mam My name is MOHD AMIR KHAN i deposited rs. 21100 in my Punjab national bank Ac my account no. Is 2308000100358945 i deposited amount 3 days before but this amount is not credited in my account yet due to covid-19 pademic im not able to go into my nearest 	@pnbindia		1244945549419134976	https://twitter.com/MohdAmirkhan0/status/1244945549419134976	USER_MENTION dear name mohd amir khan deposited r punjab national bank ac account deposited amount day amount credited account yet due covid19 pademic im able go nearest		[]							
2020-03-31	13:04:04	sudeepkanda		0	0	0	modi ji.. Please take care of our town since 50% of the town is not following lockdown. recent data says our Town might have corona cases #COVID19outbreak please make necessary action to rescue us from this deadly virus @narendramodi @PMOIndia @MoHFW_INDIA – at jaggampeta	@narendramodi @PMOIndia @MoHFW_INDIA	#COVID19outbreak	1244973738275135489	https://twitter.com/sudeepkanda/status/1244973738275135489	modi ji please take care town since town following lockdown recent data say town might corona case covid19outbreak please make necessary action rescue u deadly virus USER_MENTION USER_MENTION USER_MENTION jaggampeta		[]							
2020-03-31	13:16:29	Shubham14Mali		0	0	0	We badly need army now inside our county, who is not following the lockdown shoot that guy onsite. Shoot that all who gathered in delhi. #uneducatedpeople #21daysLockdownIndia #followlockdown @narendramodi @timesofindia @indianews18_ @ANI @BBCBreaking #NewsToday #Covid19India	@narendramodi @timesofindia @indianews18_ @ANI @BBCBreaking	#uneducatedpeople #21daysLockdownIndia #followlockdown #NewsToday #Covid19India	1244976863010643968	https://twitter.com/Shubham14Mali/status/1244976863010643968	badly need army inside county following lockdown shoot guy onsite shoot gathered delhi uneducatedpeople followlockdown USER_MENTION USER_MENTION USER_MENTION USER_MENTION USER_MENTION newstoday covid19india		[]							
2020-03-31	13:27:55	AleemIlahi		0	10	12	Thableeg Jamaat Being Victimised to cover up systemic failures: @PFIOfficial #coronavirus	@PFIOfficial	#coronavirus	1244979741385515011	https://twitter.com/AleemIlahi/status/1244979741385515011	thableeg jamaat victimised cover systemic failure USER_MENTION coronavirus		[{'score': 0.628872, 'tone_id': 'sadness', 'tone_name': 'Sadness'}]	1.0						
2020-03-31	13:45:14	prakhar66204246		0	0	0	@DGP_MP please ensure that religious places also follow the rules of lockdown they gather the crowd and used to do religious activitie. I live in badarwas mp 473885 near new jain mandir and they do these activities every day please look after the act. #PoliceState #MPDial100	@DGP_MP	#PoliceState #MPDial100	1244984098877104134	https://twitter.com/prakhar66204246/status/1244984098877104134	USER_MENTION please ensure religious place also follow rule lockdown gather crowd used religious activitie live badarwas mp near new jain mandir activity every day please look act policestate mpdial100		[{'score': 0.633185, 'tone_id': 'analytical', 'tone_name': 'Analytical'}]				1.0			
2020-03-31	13:46:35	KumarMeonly410	TataSteelLtd	0	0	0	Corona virus is the world's temporary problem, over which the world will one day conquer. But the problem of climate change and global warming arising out of urbanization and industrialization is a worldwide permanent problem. 1/2			1244984437890154497	https://twitter.com/KumarMeonly410/status/1244984437890154497	corona virus world temporary problem world one day conquer problem climate change global warming arising urbanization industrialization worldwide permanent problem		[{'score': 0.557144, 'tone_id': 'sadness', 'tone_name': 'Sadness'}, {'score': 0.8152, 'tone_id': 'analytical', 'tone_name': 'Analytical'}]	1.0			1.0			
2020-03-31	13:54:27	YearOfMonk		0	4	19	Sir @himantabiswa ,on the eve of the detection of first #COVID19 patient in Assam,there's a serious misinformation in the state that the lockdown is being relaxed from tomorrow. Also request you to kindly revoke all relaxations to specific sectors to prevent #COVID19outbreak 	@himantabiswa	#COVID19 #COVID19outbreak	1244986417635188741	https://twitter.com/YearOfMonk/status/1244986417635188741	sir USER_MENTION eve detection first covid19 patient serious misinformation state lockdown relaxed tomorrow also request kindly revoke relaxation specific sector prevent covid19outbreak		[{'score': 0.673665, 'tone_id': 'joy', 'tone_name': 'Joy'}]			1.0				
2020-03-31	14:26:26	emilyn_quinzel		0	2	0	Let’s survive this #COVID19 crisis together. We’ve gone through enough this past 3 months. Let’s support each other and get through it together as a world. No matter where you are in this world, we’ll get through this together ! - Non #AprilFoolsDay		#COVID19 #AprilFoolsDay	1244994465128828929	https://twitter.com/emilyn_quinzel/status/1244994465128828929	survive covid19 crisis together gone enough past month support get together world matter world get together non aprilfoolsday		[]							
2020-03-31	15:00:38	Pratiush_R	Megha75	1	0	0	My hair also have grown like this. By end of lockdown I might be sporting a ponytail. 			1245003072402632705	https://twitter.com/Pratiush_R/status/1245003072402632705	hair also grown like end lockdown might sporting ponytail		[{'score': 0.677867, 'tone_id': 'joy', 'tone_name': 'Joy'}, {'score': 0.946222, 'tone_id': 'tentative', 'tone_name': 'Tentative'}]			1.0			1.0	
2020-03-31	15:14:05	Manishasharan		0	0	0	#lockdown #dukhipatni #workfromhome load @Sector 55 https://www.instagram.com/p/B-ZxJ-4gD_x8p7CZZzbVgpn7_qKlpU24khQFOM0/?igshid=2ms2i2gpouk5		#lockdown #dukhipatni #workfromhome	1245006458296492032	https://twitter.com/Manishasharan/status/1245006458296492032	lockdown dukhipatni workfromhome load USER_MENTION URL		[]							
2020-03-31	15:17:37	ProfSomashekhar	vipintukur	1	0	3	Models that extend the lockdown show reduced transmission. The benefits also depend on the effectiveness of the lockdown. Having a longer ineffective lockdown will not prevent transmission &amp; will dent the economy too. Also how long should be the lockdown? At current levels, we			1245007347870773248	https://twitter.com/ProfSomashekhar/status/1245007347870773248	model extend lockdown show reduced transmission benefit also depend effectiveness lockdown longer ineffective lockdown prevent transmission dent economy also long lockdown current level		[{'score': 0.803039, 'tone_id': 'analytical', 'tone_name': 'Analytical'}]				1.0			
2020-03-31	16:24:20	Experience_JP		0	0	0	#corona #break following #passion #tabla #practice @#home @Sonipat https://www.instagram.com/p/B-Z5II1j0G4/?igshid=89tp7v4n7m1k		#corona #break #passion #tabla #practice #home	1245024136423968771	https://twitter.com/Experience_JP/status/1245024136423968771	corona break following passion tabla practice USER_MENTION USER_MENTION URL		[{'score': 0.565617, 'tone_id': 'joy', 'tone_name': 'Joy'}]			1.0				
2020-03-31	18:32:08	palpable_vagary		0	0	2	It's not #Coronavirus, it's #ChineseVirus.		#Coronavirus #ChineseVirus	1245056297520644096	https://twitter.com/palpable_vagary/status/1245056297520644096	coronavirus chinesevirus		[]							
2020-03-31	20:29:33	sarah_sundas		1	0	0	#healtheworld Lord. Let there be a miracle #Prayer #COVID		#healtheworld #Prayer #COVID	1245085846522359808	https://twitter.com/sarah_sundas/status/1245085846522359808	healtheworld lord let miracle prayer covid		[{'score': 0.595764, 'tone_id': 'joy', 'tone_name': 'Joy'}]			1.0				
2020-04-01	02:19:37	mirzaazeem		0	1	1	Dear @ArvindKejriwal you are an educated person, behave properly. Don't believe what media is propagating. Markaz already said they evacuated thousands of people, some of them were left due to lockdown. Don't you understand this? #CoronaJihad #NizamuddinMarkaz #KejriwalExposed	@ArvindKejriwal	#CoronaJihad #NizamuddinMarkaz #KejriwalExposed	1245173945503895553	https://twitter.com/mirzaazeem/status/1245173945503895553	dear USER_MENTION educated person behave properly dont believe medium propagating markaz already said evacuated thousand people left due lockdown dont understand coronajihad nizamuddinmarkaz kejriwalexposed		[{'score': 0.551415, 'tone_id': 'sadness', 'tone_name': 'Sadness'}]	1.0						
