date	time	username	to	replies	retweets	favorites	text	mentions	hashtags	id	permalink	processed_text	sentences_tone	document_tones	sadness	confident	joy	analytical	anger	tentative	fear
2020-04-09	03:15:41	SoulVersified	TheVikasKhanna	1	0	4	Yes, #lockdown can trigger comfort overeating as well as kill the appetite for some. It is important to use all resources carefully and be mindful of what, when and how much you eat. #MentalHealthTips		#lockdown #MentalHealthTips	1248087156406419456	https://twitter.com/SoulVersified/status/1248087156406419456	yes lockdown trigger comfort overeating well kill appetite important use resource carefully mindful much eat mentalhealthtips		[{'score': 0.506763, 'tone_id': 'analytical', 'tone_name': 'Analytical'}]				1.0			
2020-04-09	03:25:15	william19185		1	0	0	There are big increase in number of attacks on christians in India During these lockdown days.. #ReligiousFreedom #lockdownindia #COVIDー19 #COVID19Pandemic #Persecution @USCIRF @UNHumanRights 1/3	@USCIRF @UNHumanRights	#ReligiousFreedom #lockdownindia #COVID #COVID19Pandemic #Persecution	1248089566524801025	https://twitter.com/william19185/status/1248089566524801025	big increase number attack christian india lockdown day religiousfreedom lockdownindia covid19pandemic persecution USER_MENTION USER_MENTION		[]							
2020-04-09	03:30:00	kumar_gyanendra		1	0	0	@CMOKerala We don't Know ; How Much said News is true? But still we feel safe that we are in Kerala without any panic ; it's because of a good administration and good government Policy. #Covid_19india #Lockdown21 #Coronaindia @ZeeNews @UPGovt @PMOIndia #KeralaFightsCorona	@CMOKerala @ZeeNews @UPGovt @PMOIndia	#Covid_19india #Lockdown21 #Coronaindia #KeralaFightsCorona	1248090760945094656	https://twitter.com/kumar_gyanendra/status/1248090760945094656	USER_MENTION dont know much said news true still feel safe kerala without panic good administration good government policy covid_19india lockdown21 coronaindia USER_MENTION USER_MENTION USER_MENTION keralafightscorona		[{'score': 0.60456, 'tone_id': 'analytical', 'tone_name': 'Analytical'}]				1.0			
2020-04-09	04:38:52	pushpendraaS		0	0	0	@mybmc @mybmcWardC all kirana shoos charged more than fixed amt and more than mrp, why so much rate diffrence and post and pre lockdown, will bmc will take action on such kurana shops?	@mybmc @mybmcWardC		1248108092601937920	https://twitter.com/pushpendraaS/status/1248108092601937920	USER_MENTION USER_MENTION kirana shoos charged fixed amt mrp much rate diffrence post pre lockdown bmc take action kurana shop		[]							
2020-04-09	04:39:11	VishweshwarBhat		0	3	56	If love can fade Then so can pain So as Corona ! 			1248108173350715393	https://twitter.com/VishweshwarBhat/status/1248108173350715393	love fade pain corona		[{'score': 0.872971, 'tone_id': 'sadness', 'tone_name': 'Sadness'}]	1.0						
2020-04-09	05:09:33	RiteshKumarIND		0	0	1	Biggest threat to India is, once the #Lockdown is relaxed, various anti-social and anti-govt groups like #TablighiJamaat will start spreading the virus once again. Govt should take full precautions to contain ALL such groups. I wonder if other countries also face similar threats.		#Lockdown #TablighiJamaat	1248115814101704705	https://twitter.com/RiteshKumarIND/status/1248115814101704705	biggest threat india lockdown relaxed various antisocial antigovt group like tablighijamaat start spreading virus govt take full precaution contain group wonder country also face similar threat		[{'score': 0.658417, 'tone_id': 'fear', 'tone_name': 'Fear'}, {'score': 0.57374, 'tone_id': 'tentative', 'tone_name': 'Tentative'}]						1.0	1.0
2020-04-09	06:32:48	amarprasadreddy	urstrulyVenkata	1	0	1	The service done by Corona warriors is like mother giving life to a baby. The purest form of divinity. We must offer prayers for their happiness &amp; prosperity #ThankYouCoronaWarriors urs, @amarprasadreddy Advisor to Union Minister of State for Health and Family Welfare, Govt.	@amarprasadreddy	#ThankYouCoronaWarriors	1248136764671188995	https://twitter.com/amarprasadreddy/status/1248136764671188995	service done corona warrior like mother giving life baby purest form divinity must offer prayer happiness prosperity thankyoucoronawarriors ur USER_MENTION advisor union minister state health family welfare govt		[{'score': 0.744721, 'tone_id': 'joy', 'tone_name': 'Joy'}]			1.0				
2020-04-09	08:34:09	DayanandSopte		0	0	0	The site is live! and started receiving orders from across 9 Panchayats of Mandrem Constituency. For Direct Order placement, click the link below https://mdestinations.com/product/basic-essential-grocery-pack-1/mandrem-basic-essential-grocery-pack/ . #StayHomeGetDelivered #stayhomestaysafe #COVID19 – at Mandrem		#StayHomeGetDelivered #stayhomestaysafe #COVID19	1248167304384270336	https://twitter.com/DayanandSopte/status/1248167304384270336	site live started receiving order across panchayat mandrem constituency direct order placement click link URL stayhomegetdelivered stayhomestaysafe covid19 mandrem		[{'score': 0.752266, 'tone_id': 'analytical', 'tone_name': 'Analytical'}]				1.0			
2020-04-09	09:50:06	DevinaSarwatay		0	0	0	Yay @HydUniv floated a #survey asking #students of #access to stable electricity internet &amp; devices for #classes #online + options: synchronous asynchronous both. No assumptions Asking for input Using data for decisionmaking #UoH is smart Be like UoH #COVID19 #CoronaVirus	@HydUniv	#survey #students #access #classes #online #UoH #COVID19 #CoronaVirus	1248186415411646465	https://twitter.com/DevinaSarwatay/status/1248186415411646465	yay USER_MENTION floated survey asking student access stable electricity internet device class online option synchronous asynchronous assumption asking input using data decisionmaking uoh smart like uoh covid19 coronavirus		[{'score': 0.658229, 'tone_id': 'joy', 'tone_name': 'Joy'}, {'score': 0.539686, 'tone_id': 'analytical', 'tone_name': 'Analytical'}]			1.0	1.0			
2020-04-09	11:40:25	Direct_Dil_se_	akshaykumar	0	0	0	#DilSeThankYou to - All the doctors, nurses &amp; medical staff. - The police department. - Entire cleaning &amp; sanitisation staff. - All donors towards Corona relief. - All traders, restaurant owners etc for bearing the heavy losses. - All the citizens for following the #lockdown. 		#DilSeThankYou #lockdown	1248214176465424384	https://twitter.com/Direct_Dil_se_/status/1248214176465424384	dilsethankyou doctor nurse medical staff police department entire cleaning sanitisation staff donor towards corona relief trader restaurant owner etc bearing heavy loss citizen following lockdown		[{'score': 0.574612, 'tone_id': 'sadness', 'tone_name': 'Sadness'}]	1.0						
2020-04-09	12:58:18	ajeybharatnews		0	0	0	"Instructions for filing online claims for the purpose - ""Outbreak of Pandemic (COVID-19)"" #IndiaFightsCorona #EPFO #CoronavirusOutbreak #SocialSecurity #StayHomeStaySafe"		#IndiaFightsCorona #EPFO #CoronavirusOutbreak #SocialSecurity #StayHomeStaySafe	1248233779669409792	https://twitter.com/ajeybharatnews/status/1248233779669409792	instruction filing online claim purpose outbreak pandemic covid19 indiafightscorona epfo coronavirusoutbreak socialsecurity stayhomestaysafe		[{'score': 0.642915, 'tone_id': 'analytical', 'tone_name': 'Analytical'}]				1.0			
2020-04-09	14:40:38	MunafKalia		1	0	0	#Coronavirus global updates as on 9/4/20 @19.00PST: Total cases: 1,538,000 Total deaths: 90,000 US states by most coronavirus deaths: New York: 6,268 New Jersey: 1,504 Michigan: 959 Louisiana: 652 California: 505 Illinois: 462 Massachusetts: 433 Washington: 431 Georgia: 370		#Coronavirus	1248259531857178624	https://twitter.com/MunafKalia/status/1248259531857178624	coronavirus global update USER_MENTION total case total death u state coronavirus death new york new jersey michigan louisiana california illinois massachusetts washington georgia		[{'score': 0.65822, 'tone_id': 'sadness', 'tone_name': 'Sadness'}, {'score': 0.609545, 'tone_id': 'confident', 'tone_name': 'Confident'}]	1.0	1.0					
2020-04-09	16:23:38	sajadhameedpj		1	1	6	Tangmarg: Panic gripped Tangmarg on Thursday after 08 more persons were tested positive for Covid-19 in a single day, taking the total number of active cases in the sub district Tangmarg to 14. #COVID19 @av_eleena @waseemjourno @SajadGul12 @MuneerHussein3 @SajadGul12	@av_eleena @Waseemjourno @SajadGul12 @MuneerHussein3 @SajadGul12	#COVID19	1248285450982141953	https://twitter.com/sajadhameedpj/status/1248285450982141953	tangmarg panic gripped tangmarg thursday person tested positive covid19 single day taking total number active case sub district tangmarg covid19 USER_MENTION USER_MENTION USER_MENTION USER_MENTION USER_MENTION		[{'score': 0.661808, 'tone_id': 'joy', 'tone_name': 'Joy'}, {'score': 0.718823, 'tone_id': 'confident', 'tone_name': 'Confident'}]		1.0	1.0				
2020-04-09	16:31:09	SanjoyB89808926		0	0	0	@narendramodi Sir BSNL KOLKATA ALL JOB COMPLETED BY JOB CONTACT LABOUR. THIS J. C. L BSNL 12 MONTHS SALARI DOES NOT PAID THIS LOCKDOWN TIME A. THIS LABOUR S FAMILY R POSITION IS VERY DENGER AND POUR CRITICAL PROBLEM...	@narendramodi		1248287342030446592	https://twitter.com/SanjoyB89808926/status/1248287342030446592	USER_MENTION sir bsnl kolkata job completed job contact labour j c l bsnl month salari paid lockdown time labour family r position denger pour critical problem		[{'score': 0.552834, 'tone_id': 'sadness', 'tone_name': 'Sadness'}]	1.0						
2020-04-09	16:38:14	bafnaramesh1		0	0	0	Covid19 Situation in Italy 			1248289127629381632	https://twitter.com/bafnaramesh1/status/1248289127629381632	covid19 situation italy		[]							
2020-04-09	16:38:54	hardiksompura	aravindchaudhri	0	0	0	Thank you corona warriors. God bless you all. Stay safe. 			1248289295447683072	https://twitter.com/hardiksompura/status/1248289295447683072	thank corona warrior god bless stay safe		[{'score': 0.908061, 'tone_id': 'joy', 'tone_name': 'Joy'}, {'score': 0.801827, 'tone_id': 'analytical', 'tone_name': 'Analytical'}]			1.0	1.0			
2020-04-09	17:48:27	ShjBFFriendly		1	0	0	Sharjah Child Friendly office launched an awareness campaign to emphasize the need for mothers to continue breastfeeding, while adhering to the public health standards and safety measures, in light of the current situation of the spread of COVID-19 pandemic.			1248306795657007104	https://twitter.com/ShjBFFriendly/status/1248306795657007104	sharjah child friendly office launched awareness campaign emphasize need mother continue breastfeeding adhering public health standard safety measure light current situation spread covid19 pandemic		[{'score': 0.866577, 'tone_id': 'analytical', 'tone_name': 'Analytical'}]				1.0			
2020-04-09	18:01:16	livdmoment		0	0	0	@narendramodi Sir , I’m A Lad Located In New Delhi , I’ve Heard A Lot of Folks From United States Are Effected From Corona Virus , So Allowing The Export Of “ Hydroxychloroquine Drug/Medicine “ Was A Great Gesture “ HUMANITY SHOULD ALWAYS WIN AT THIS TIME OF CRISIS “	@narendramodi		1248310020787195904	https://twitter.com/livdmoment/status/1248310020787195904	USER_MENTION sir lad located new delhi heard lot folk united state effected corona virus allowing export hydroxychloroquine great gesture humanity always win time crisis		[{'score': 0.660475, 'tone_id': 'joy', 'tone_name': 'Joy'}, {'score': 0.506763, 'tone_id': 'analytical', 'tone_name': 'Analytical'}]			1.0	1.0			
2020-04-09	18:32:50	tatinenis		0	0	4	So #proningincovid19 is working tremendously, do consider early proning, don't get decieved with bad CXR n CT scans thinking complaince is low, it's not in contrary patient with 70 IBW was generating more than 650 ml TVs,higher PEEP was not required in this case #COVID19 #RTLife		#proningincovid19 #COVID19 #RTLife	1248317968481583104	https://twitter.com/tatinenis/status/1248317968481583104	proningincovid19 working tremendously consider early proning dont get decieved bad cxr n ct scan thinking complaince low contrary patient ibw generating ml peep required case covid19 rtlife		[{'score': 0.849929, 'tone_id': 'analytical', 'tone_name': 'Analytical'}]				1.0			
2020-04-10	01:36:39	sandeepkabra30		0	0	0	@narendramodi @PMOIndia @AmitShah @uddhavthackeray @JPNadda Lions in new york cats in kerela infected by COVID. Pets are great risk for community spread. Please pass order that like humans, their pet dogs and cats also have to be locked in own homes and street dogs caged.	@narendramodi @PMOIndia @AmitShah @uddhavthackeray @JPNadda		1248424621767921669	https://twitter.com/sandeepkabra30/status/1248424621767921669	USER_MENTION USER_MENTION USER_MENTION USER_MENTION USER_MENTION lion new york cat kerela infected covid pet great risk community spread please pas order like human pet dog cat also locked home street dog caged		[{'score': 0.676623, 'tone_id': 'joy', 'tone_name': 'Joy'}]			1.0				
2020-04-10	03:02:31	ammarmh_	Que_Moses	2	1	9	He involved with Imaret & already make thousand of contributions to Covid-19.			1248446232466305024	https://twitter.com/ammarmh_/status/1248446232466305024	involved imaret already make thousand contribution covid19		[]							
2020-04-10	03:23:35	vinaygoyal65	JhaSanjay	0	0	0	Indians are fighting Corona and You are are fighting for election. Shame.			1248451534616055816	https://twitter.com/vinaygoyal65/status/1248451534616055816	indian fighting corona fighting election shame		[{'score': 0.643462, 'tone_id': 'sadness', 'tone_name': 'Sadness'}]	1.0						
2020-04-10	03:34:34	priyagupta999		2	4	31	.’Heartless China’ versus ‘Humane India’ is a huge advantage for #India to make the ‘Made in India’ a big reality #PC (Post Corona).... @narendramodi	@narendramodi	#India #PC	1248454297525702657	https://twitter.com/priyagupta999/status/1248454297525702657	versus huge advantage india make big reality pc post corona USER_MENTION		[{'score': 0.579436, 'tone_id': 'confident', 'tone_name': 'Confident'}, {'score': 0.653099, 'tone_id': 'analytical', 'tone_name': 'Analytical'}]		1.0		1.0			
2020-04-10	06:49:59	amarprasadreddy	Kamleshsingh92	0	0	0	The service done by Corona warriors is like mother giving life to a baby. The purest form of divinity. We must offer prayers for their happiness &amp; prosperity #ThankYouCoronaWarriors urs, @amarprasadreddy Advisor to Union Minister of State for Health and Family Welfare, Govt.	@amarprasadreddy	#ThankYouCoronaWarriors	1248503474486013956	https://twitter.com/amarprasadreddy/status/1248503474486013956	service done corona warrior like mother giving life baby purest form divinity must offer prayer happiness prosperity thankyoucoronawarriors ur USER_MENTION advisor union minister state health family welfare govt		[{'score': 0.744721, 'tone_id': 'joy', 'tone_name': 'Joy'}]			1.0				
2020-04-10	07:02:37	amarprasadreddy	InduruMan	1	1	1	The service done by Corona warriors is like mother giving life to a baby. The purest form of divinity. We must offer prayers for their happiness &amp; prosperity #ThankYouCoronaWarriors urs, @amarprasadreddy Advisor to Union Minister of State for Health and Family Welfare, Govt.	@amarprasadreddy	#ThankYouCoronaWarriors	1248506654322085888	https://twitter.com/amarprasadreddy/status/1248506654322085888	service done corona warrior like mother giving life baby purest form divinity must offer prayer happiness prosperity thankyoucoronawarriors ur USER_MENTION advisor union minister state health family welfare govt		[{'score': 0.744721, 'tone_id': 'joy', 'tone_name': 'Joy'}]			1.0				
2020-04-10	07:58:32	RitikDixit0000		0	0	2	In frame @WarrenBuffet Make your own worth #business #entrepreneur #marketing #success #motivation #money #entrepreneurship #smallbusiness #businessowner #inspirational #WorkFromHome #DigitalMarketing #lifestyle #branding #goals #realestate #mindset #LifeLessons #Corona 	@warrenbuffet	#business #entrepreneur #marketing #success #motivation #money #entrepreneurship #smallbusiness #businessowner #inspirational #WorkFromHome #DigitalMarketing #lifestyle #branding #goals #realestate #mindset #LifeLessons #Corona	1248520728829399040	https://twitter.com/RitikDixit0000/status/1248520728829399040	frame USER_MENTION make worth business entrepreneur marketing success motivation money entrepreneurship smallbusiness businessowner inspirational workfromhome digitalmarketing lifestyle branding goal realestate mindset lifelessons corona		[{'score': 0.932784, 'tone_id': 'joy', 'tone_name': 'Joy'}]			1.0				
2020-04-10	08:04:44	PranayMaske786		0	1	9	Hum Hoge Kamyaab.. Fight against Corona @akshaykumar @PMOIndia @narendramodi @ChouhanShivraj @bomanirani @ArshadWarsi @vickykaushal09 @advani_kiara @ayushmannk @kritisanon @boxervijender @aajtak @ABVPVoice @ANI @CMMadhyaPradesh	@akshaykumar @PMOIndia @narendramodi @ChouhanShivraj @bomanirani @ArshadWarsi @vickykaushal09 @advani_kiara @ayushmannk @kritisanon @boxervijender @aajtak @ABVPVoice @ANI @CMMadhyaPradesh		1248522289450119168	https://twitter.com/PranayMaske786/status/1248522289450119168	hum hoge kamyaab fight corona USER_MENTION USER_MENTION USER_MENTION USER_MENTION USER_MENTION USER_MENTION USER_MENTION USER_MENTION USER_MENTION USER_MENTION USER_MENTION USER_MENTION USER_MENTION USER_MENTION USER_MENTION		[{'score': 0.589977, 'tone_id': 'joy', 'tone_name': 'Joy'}]			1.0				
2020-04-10	11:22:59	bhavikajTOI		0	9	26	There is good news coming in from the sleepy town of Islampur, Sangli. Of the 26 #COVID19 cases reported there, 22 have tested negative. With this #islampur is leading the way in containment measures and implementing #lockdown completely.		#COVID19 #islampur #lockdown	1248572179626602497	https://twitter.com/bhavikajTOI/status/1248572179626602497	good news coming sleepy town islampur sangli covid19 case reported tested negative islampur leading way containment measure implementing lockdown completely		[{'score': 0.564839, 'tone_id': 'joy', 'tone_name': 'Joy'}, {'score': 0.780088, 'tone_id': 'analytical', 'tone_name': 'Analytical'}, {'score': 0.704642, 'tone_id': 'confident', 'tone_name': 'Confident'}]		1.0	1.0	1.0			
2020-04-10	12:37:32	viralbhayani77		0	0	0	Images from Delhi. Missing it so much #delhiinlockdown #delhidiaries . . Music: Golden Musician: Jef Subhash Baloria #delhi #viralbhayani #lockdown @viralbhayani77 @New Delhi https://www.instagram.com/p/B-zPK1tn_ZY/?igshid=evameu57kxlk	@viralbhayani77	#delhiinlockdown #delhidiaries #delhi #viralbhayani #lockdown	1248590941629419520	https://twitter.com/viralbhayani77/status/1248590941629419520	image delhi missing much delhiinlockdown delhidiaries music golden musician jef subhash baloria delhi viralbhayani lockdown USER_MENTION USER_MENTION delhi URL		[]							
2020-04-10	14:30:46	Abhishe90167976		0	0	2	I recommend Aarogya Setu app to fight against COVID19. Please download and share it using this link Android : https://play.google.com/store/apps/details?id=nic.goi.aarogyasetu iOS : https://apps.apple.com/in/app/aarogyasetu/id1505825357 @Ashutos32644600 @ArjunSi68561653 #AarogyaSetu	@Ashutos32644600 @ArjunSi68561653	#AarogyaSetu	1248619438032580608	https://twitter.com/Abhishe90167976/status/1248619438032580608	recommend aarogya setu app fight covid19 please download share using link android URL io URL USER_MENTION USER_MENTION aarogyasetu		[{'score': 0.724236, 'tone_id': 'analytical', 'tone_name': 'Analytical'}]				1.0			
2020-04-10	14:39:46	neilellis		1	0	0	 Iran: Under control, and improving slightly, contagion. Est. 0.56% of pop. infected. Much, much worse to come. Proj. death toll 9,665 after 93 days. 10/04 #Covid 1/4		#Covid	1248621701312548870	https://twitter.com/neilellis/status/1248621701312548870	iran control improving slightly contagion est pop infected much much worse come proj death toll day covid		[{'score': 0.574795, 'tone_id': 'sadness', 'tone_name': 'Sadness'}]	1.0						
2020-04-10	16:03:46	vascoy	waglenikhil	0	0	0	Why ?? Please explain . Getting bored man .make the lockdown exciting .			1248642840944463874	https://twitter.com/vascoy/status/1248642840944463874	please explain getting bored man make lockdown exciting		[{'score': 0.567494, 'tone_id': 'sadness', 'tone_name': 'Sadness'}, {'score': 0.762356, 'tone_id': 'analytical', 'tone_name': 'Analytical'}]	1.0			1.0			
2020-04-10	16:04:28	faazeldastani	TimesNow	0	0	0	Is this for real????? If yes then I also want to celebrate my 8 years old's birthday which I didn't celebrate yesterday due to lockdown!!! @PMOIndia @narendramodi please respond!	@PMOIndia @narendramodi		1248643018770411521	https://twitter.com/faazeldastani/status/1248643018770411521	real yes also want celebrate year old birthday didnt celebrate yesterday due lockdown USER_MENTION USER_MENTION please respond		[]							
2020-04-10	16:13:24	fairuz_azmi83		1	1	6	To actually organise a video recording activity with the aim to condemn the management of COVID-19 is not a great move. You are digging your own grave.			1248645264711114758	https://twitter.com/fairuz_azmi83/status/1248645264711114758	actually organise video recording activity aim condemn management covid19 great move digging grave		[{'score': 0.865637, 'tone_id': 'analytical', 'tone_name': 'Analytical'}, {'score': 0.775702, 'tone_id': 'confident', 'tone_name': 'Confident'}]		1.0		1.0			
2020-04-10	18:03:55	kamleshsutar		1	1	7	#coronavirus #Maharashtra #Updates ◆Total new cases in last 24 hrs - 210 ◆Total cases in state - 1574 ◆Total deaths in last 24 hrs - 13 (Total-110) ◆Total cases in Mumbai - 1008 ◆Total deaths in Mumbai alone 64 Discharged - 188 #MaharashtraFightsCorona #COVIDー19		#coronavirus #Maharashtra #Updates #MaharashtraFightsCorona #COVID	1248673077434576896	https://twitter.com/kamleshsutar/status/1248673077434576896	coronavirus maharashtra update new case last hr case state death last hr total110 case mumbai death mumbai alone discharged maharashtrafightscorona		[{'score': 0.808841, 'tone_id': 'sadness', 'tone_name': 'Sadness'}, {'score': 0.728394, 'tone_id': 'analytical', 'tone_name': 'Analytical'}]	1.0			1.0			
2020-04-10	18:58:36	meer_ishtiaq		0	2	8	Young Staff Nurse Sadaf Jameel admitted in Aziz Bhati Hospital Gujrat Corona Isolation ward was on Ventilator. passed away today May her soul rest in peace Ameen 			1248686837696167937	https://twitter.com/meer_ishtiaq/status/1248686837696167937	young staff nurse sadaf jameel admitted aziz bhati hospital gujrat corona isolation ward ventilator passed away today may soul rest peace ameen		[{'score': 0.90384, 'tone_id': 'sadness', 'tone_name': 'Sadness'}]	1.0						
2020-04-10	19:39:29	faizanmunaf		0	0	2	What’s the situation of animals at Karachi Zoo?? Un becharon ki koi update hai? Any idea @ecoist_noor @Kali_Ghata @MariaPtweets #Karachi #KarachiLockdown #Lockdown #KarachiZoo #Pakistan	@ecoist_noor @Kali_Ghata @MariaPtweets	#Karachi #KarachiLockdown #Lockdown #KarachiZoo #Pakistan	1248697125774544896	https://twitter.com/faizanmunaf/status/1248697125774544896	situation animal karachi zoo un becharon ki koi update hai idea USER_MENTION USER_MENTION USER_MENTION karachi karachilockdown lockdown karachizoo pakistan		[]							
2020-04-11	01:33:38	mysoul4syria	spectatorindex	0	0	0	I think this corona virus came because of the Chinese had shortage of meat so they started to eat anything walks not human. Stop the chines or quarantine them.			1248786254105321482	https://twitter.com/mysoul4syria/status/1248786254105321482	think corona virus came chinese shortage meat started eat anything walk human stop chine quarantine		[{'score': 0.532616, 'tone_id': 'analytical', 'tone_name': 'Analytical'}, {'score': 0.647986, 'tone_id': 'tentative', 'tone_name': 'Tentative'}]				1.0		1.0	
2020-04-11	06:08:04	vkpandagle		0	0	0	‘Took it head-on’: IAS officer Tina Dabi on how Bhilwara model for Covid-19 worked - india news - Hindustan Times - 			1248855316684402688	https://twitter.com/vkpandagle/status/1248855316684402688	ia officer tina dabi bhilwara model covid19 worked india news hindustan time		[]							
2020-04-11	06:26:38	khernagarGanesh		0	0	3	In such a epidemic situation of Covid-19 we can see our Government officials,Medical staffs,Police,Bmc workers,Banker's stepping out of house to perform thier duty. We KSGM would like to Thank each one of you. #GovernmentOfIndia #cmomaharashtra #MumbaiPolice		#GovernmentOfIndia #cmomaharashtra #MumbaiPolice	1248859987549421569	https://twitter.com/khernagarGanesh/status/1248859987549421569	epidemic situation covid19 see government stepping house perform thier duty ksgm would like thank one governmentofindia cmomaharashtra mumbaipolice		[]							
2020-04-11	07:14:45	NavinParashar5		0	0	3	Today's Situation...! My Pencil sketch #coronavirusoutbreak #corona #stopthisvirus #SaturdayMorning #Lockdownextention		#coronavirusoutbreak #corona #stopthisvirus #SaturdayMorning #Lockdownextention	1248872095255334915	https://twitter.com/NavinParashar5/status/1248872095255334915	today situation pencil sketch coronavirusoutbreak corona stopthisvirus saturdaymorning lockdownextention		[]							
2020-04-11	07:57:50	Lawteaser		0	0	0	@vpsbadnore @manuparida1 wonderful gesture. large hearts being shown by Chandigarh in contributing to Corona Relief Fund by His Execellency. The Commissioner, MC, Chandigarh and Chd Housing Board in the list of Donors as major contributors, 50 lacs &amp; 6.45 lacs - ??	@vpsbadnore @manuparida1		1248882940638945280	https://twitter.com/Lawteaser/status/1248882940638945280	USER_MENTION USER_MENTION wonderful gesture large heart shown chandigarh contributing corona relief fund execellency commissioner mc chandigarh chd housing board list donor major contributor lac lac		[{'score': 0.637533, 'tone_id': 'joy', 'tone_name': 'Joy'}]			1.0				
